{
  "$schema": "./schemas/user-model-snapshot.schema.json",
  "user_id": "RNA4219",
  "preferences": {
    "language": "ja",
    "detail_level": "moderate",
    "auto_approve_threshold": "none",
    "notification_frequency": "daily",
    "timezone": "Asia/Tokyo"
  },
  "approval_style": {
    "review_depth": "standard",
    "require_explanation": true,
    "require_tests": true,
    "require_docs": false,
    "batch_approve": false
  },
  "output_conventions": {
    "format": "markdown",
    "line_length_limit": 120,
    "indent_style": "spaces",
    "emoji_usage": "minimal",
    "summary_style": "bullet"
  },
  "review_history": {
    "total_reviews": 42,
    "approval_rate": 0.85,
    "common_feedback": [
      "行長120文字制限遵守",
      "テスト必須",
      "docs更新推奨"
    ]
  },
  "reviewed_at": "2026-05-03T00:00:00Z",
  "reviewer": "docs-core",
  "review_state": "approved",
  "created_at": "2026-05-02T12:00:00Z",
  "updated_at": "2026-05-03T00:00:00Z",
  "schema_version": "1.0.0"
}